{
    "node": {
        "specs": {
            "store": {
                "0": {
                    "name": "Root",
                    "kind": "Root"
                },
                "1": {
                    "name": "Multi Port Publisher",
                    "kind": {
                        "Leaf": "Action"
                    }
                },
                "2": {
                    "name": "Multi Port Subscriber",
                    "kind": {
                        "Leaf": "Action"
                    }
                },
                "3": {
                    "name": "Sequence",
                    "kind": "Control"
                }
            }
        },
        "nodes": {
            "store": {
                "0": {
                    "spec_id": 0,
                    "children": [
                        3
                    ]
                },
                "1": {
                    "spec_id": 1,
                    "children": []
                },
                "2": {
                    "spec_id": 2,
                    "children": []
                },
                "3": {
                    "spec_id": 3,
                    "children": [
                        1,
                        2
                    ]
                }
            }
        }
    },
    "port": {
        "states": {
            "3": {},
            "2": {
                "3": {
                    "source": "Internal"
                },
                "4": {
                    "source": "Internal"
                },
                "0": {
                    "source": "Internal"
                },
                "1": {
                    "source": "Internal"
                },
                "2": {
                    "source": "Internal"
                }
            },
            "1": {
                "1": {
                    "source": "Internal"
                },
                "2": {
                    "source": "Internal"
                },
                "3": {
                    "source": "Internal"
                },
                "4": {
                    "source": "Internal"
                },
                "0": {
                    "source": "Internal"
                }
            },
            "0": {}
        },
        "connections": [
            {
                "node_id": 2,
                "port_id": 1,
                "channel_id": 0
            },
            {
                "node_id": 1,
                "port_id": 4,
                "channel_id": 1
            },
            {
                "node_id": 1,
                "port_id": 0,
                "channel_id": 0
            },
            {
                "node_id": 2,
                "port_id": 3,
                "channel_id": 1
            },
            {
                "node_id": 1,
                "port_id": 2,
                "channel_id": 1
            },
            {
                "node_id": 2,
                "port_id": 0,
                "channel_id": 0
            },
            {
                "node_id": 1,
                "port_id": 1,
                "channel_id": 0
            },
            {
                "node_id": 2,
                "port_id": 2,
                "channel_id": 1
            },
            {
                "node_id": 1,
                "port_id": 3,
                "channel_id": 1
            },
            {
                "node_id": 2,
                "port_id": 4,
                "channel_id": 1
            }
        ]
    },
    "parameter": {
        "parameters": {}
    },
    "channel": {
        "specs": {
            "store": {
                "0": {
                    "msg_hash": {
                        "hash": 13315934175031694117
                    },
                    "msg_type_name": "Pose"
                }
            }
        },
        "channels": {
            "store": {
                "0": {
                    "spec_id": 0,
                    "config": {
                        "capacity": 1,
                        "count": {
                            "sender": 2,
                            "receiver": 2
                        },
                        "kind": {
                            "Tokio": "Broadcast"
                        }
                    }
                },
                "1": {
                    "spec_id": 0,
                    "config": {
                        "capacity": 1,
                        "count": {
                            "sender": 3,
                            "receiver": 3
                        },
                        "kind": {
                            "Tokio": "Broadcast"
                        }
                    }
                }
            }
        }
    }
}